1773	i would like to see all of the movies with a length that is the shortest and a rating count of 5 or more .	[ aggregateRating . ratingValue , duration ] of sort ( duration asc of @org.schema.Movie . Movie ( ) filter aggregateRating . ratingCount >= 5 ) [ 1 ] ;
1774	show me the movie pictures that have no more than 7 directors .	[ image ] of @org.schema.Movie . Movie ( ) filter count ( director ) <= 7 ;
1775	find the images of movies which contained 7 or less directors .	[ image ] of @org.schema.Movie . Movie ( ) filter count ( director ) <= 7 ;
1776	what is the length of the longest QUOTED_STRING_0	[ duration ] of sort ( duration desc of @org.schema.Movie . Movie ( ) filter id =~ QUOTED_STRING_0 ) [ 1 ] ;
1777	get the length of the longest QUOTED_STRING_0	[ duration ] of sort ( duration desc of @org.schema.Movie . Movie ( ) filter id =~ QUOTED_STRING_0 ) [ 1 ] ;
1780	describe the longest lasting QUOTED_STRING_0	[ description ] of sort ( duration desc of @org.schema.Movie . Movie ( ) filter id =~ QUOTED_STRING_0 ) [ 1 ] ;
1781	what is the description of the longest QUOTED_STRING_0	[ description ] of sort ( duration desc of @org.schema.Movie . Movie ( ) filter id =~ QUOTED_STRING_0 ) [ 1 ] ;
1782	what movie by no fewer than 10 directors has the longest duration	sort ( duration desc of @org.schema.Movie . Movie ( ) filter count ( director ) >= 10 ) [ 1 ] ;
1783	what is the movie with no less than 10 directors with the longest duration	sort ( duration desc of @org.schema.Movie . Movie ( ) filter count ( director ) >= 10 ) [ 1 ] ;
1784	what is the lengths of the longest QUOTED_STRING_0 .	[ duration ] of sort ( duration desc of @org.schema.Movie . Movie ( ) filter id =~ QUOTED_STRING_0 ) [ 1 ] ;
1785	what is the length of the longest lasting QUOTED_STRING_0 . the	[ duration ] of sort ( duration desc of @org.schema.Movie . Movie ( ) filter id =~ QUOTED_STRING_0 ) [ 1 ] ;
1788	what is the description of the longest lasting QUOTED_STRING_0 ?	[ description ] of sort ( duration desc of @org.schema.Movie . Movie ( ) filter id =~ QUOTED_STRING_0 ) [ 1 ] ;
1789	give me the description of QUOTED_STRING_0 that has the longest run time .	[ description ] of sort ( duration desc of @org.schema.Movie . Movie ( ) filter id =~ QUOTED_STRING_0 ) [ 1 ] ;
1790	i need the movie that lasts the longest with no less than 10 directors .	sort ( duration desc of @org.schema.Movie . Movie ( ) filter count ( director ) >= 10 ) [ 1 ] ;
1791	search for a movie with no less than 10 directors that lasts the longest .	sort ( duration desc of @org.schema.Movie . Movie ( ) filter count ( director ) >= 10 ) [ 1 ] ;
1792	find the length of the QUOTED_STRING_0 with the greatest duration	[ duration ] of sort ( duration desc of @org.schema.Movie . Movie ( ) filter id =~ QUOTED_STRING_0 ) [ 1 ] ;
1793	show me the length of the QUOTED_STRING_0 that has the maximum duration	[ duration ] of sort ( duration desc of @org.schema.Movie . Movie ( ) filter id =~ QUOTED_STRING_0 ) [ 1 ] ;
1796	show me the description of the QUOTED_STRING_0 that has the greatest length	[ description ] of sort ( duration desc of @org.schema.Movie . Movie ( ) filter id =~ QUOTED_STRING_0 ) [ 1 ] ;
1797	tell me the description of QUOTED_STRING_0 that has the longest length	[ description ] of sort ( duration desc of @org.schema.Movie . Movie ( ) filter id =~ QUOTED_STRING_0 ) [ 1 ] ;
1798	find me a movie with no fewer than 10 directors that has the longest duration	sort ( duration desc of @org.schema.Movie . Movie ( ) filter count ( director ) >= 10 ) [ 1 ] ;
1799	i 'm looking for a movie with minimum 10 directors that has the largest duration	sort ( duration desc of @org.schema.Movie . Movie ( ) filter count ( director ) >= 10 ) [ 1 ] ;
1800	i want movies with at least one genre that has been rated the highest number of times .	sort ( aggregateRating . ratingCount desc of @org.schema.Movie . Movie ( ) filter count ( genre ) >= 0 ) [ 1 ] ;
1801	give me movies that have at least one genre which has received the highest number of ratings .	sort ( aggregateRating . ratingCount desc of @org.schema.Movie . Movie ( ) filter count ( genre ) >= 0 ) [ 1 ] ;
1802	i want the link of the lowest-rated movies .	[ url ] of sort ( aggregateRating . ratingValue asc of @org.schema.Movie . Movie ( ) ) [ 1 ] ;
1803	give me the link of movies that are rated the lowest .	[ url ] of sort ( aggregateRating . ratingValue asc of @org.schema.Movie . Movie ( ) ) [ 1 ] ;
1804	give me movies that have 2 actresses .	@org.schema.Movie . Movie ( ) filter count ( actor ) == 2 ;
1805	what movies have 2 actresses ?	@org.schema.Movie . Movie ( ) filter count ( actor ) == 2 ;
1806	i want the publication date of the shortest running movie .	[ datePublished ] of sort ( duration asc of @org.schema.Movie . Movie ( ) ) [ 1 ] ;
1807	when was the movie with the shortest length published ?	[ datePublished ] of sort ( duration asc of @org.schema.Movie . Movie ( ) ) [ 1 ] ;
1808	find movies that have over 0 genres and the largest rating count	sort ( aggregateRating . ratingCount desc of @org.schema.Movie . Movie ( ) filter count ( genre ) >= 0 ) [ 1 ] ;
1809	i want movies with more than 0 genres that have the highest count for ratings	sort ( aggregateRating . ratingCount desc of @org.schema.Movie . Movie ( ) filter count ( genre ) >= 0 ) [ 1 ] ;
1810	show me the movie links with the smallest rating	[ url ] of sort ( aggregateRating . ratingValue asc of @org.schema.Movie . Movie ( ) ) [ 1 ] ;
1811	i need to know the movie link with the least rating	[ url ] of sort ( aggregateRating . ratingValue asc of @org.schema.Movie . Movie ( ) ) [ 1 ] ;
1812	find the movies with 2 actress	@org.schema.Movie . Movie ( ) filter count ( actor ) == 2 ;
1813	show me the movies with 2 actress	@org.schema.Movie . Movie ( ) filter count ( actor ) == 2 ;
1814	i need to know the date the movie was published that has the least duration	[ datePublished ] of sort ( duration asc of @org.schema.Movie . Movie ( ) ) [ 1 ] ;
1815	find me the date that the movie got published that has the shortest duration	[ datePublished ] of sort ( duration asc of @org.schema.Movie . Movie ( ) ) [ 1 ] ;
1816	show me movies that are in different genres with highest ratings	sort ( aggregateRating . ratingCount desc of @org.schema.Movie . Movie ( ) filter count ( genre ) >= 0 ) [ 1 ] ;
1817	search for movies with multiple genres with the highest ratings	sort ( aggregateRating . ratingCount desc of @org.schema.Movie . Movie ( ) filter count ( genre ) >= 0 ) [ 1 ] ;
1818	show me the links of movies that have the lowest ratings	[ url ] of sort ( aggregateRating . ratingValue asc of @org.schema.Movie . Movie ( ) ) [ 1 ] ;
1819	give me the links to movies that have the lowest ratings	[ url ] of sort ( aggregateRating . ratingValue asc of @org.schema.Movie . Movie ( ) ) [ 1 ] ;
1820	give me some movies that feature 2 actresses	@org.schema.Movie . Movie ( ) filter count ( actor ) == 2 ;
1821	show me some movies with two actresses	@org.schema.Movie . Movie ( ) filter count ( actor ) == 2 ;
1822	give me the date published of the movie with the shortest duration	[ datePublished ] of sort ( duration asc of @org.schema.Movie . Movie ( ) ) [ 1 ] ;
1823	when was the publication date of the movie with the shortest duration	[ datePublished ] of sort ( duration asc of @org.schema.Movie . Movie ( ) ) [ 1 ] ;
1824	show me the movies rated 4 and 4 stars .	@org.schema.Movie . Movie ( ) filter aggregateRating . ratingValue == 4 && aggregateRating . ratingValue == 4 ;
1825	give all of the movies that are rated 4 and 4 stars .	@org.schema.Movie . Movie ( ) filter aggregateRating . ratingValue == 4 && aggregateRating . ratingValue == 4 ;
1826	find the longest running movie that has a rating count higher than 3 and at least 6 directors	sort ( duration desc of @org.schema.Movie . Movie ( ) filter aggregateRating . ratingCount >= 3 && count ( director ) >= 6 ) [ 1 ] ;
1827	find the longest lasting movie with at least 6 directors and a rating count higher than 3 .	sort ( duration desc of @org.schema.Movie . Movie ( ) filter aggregateRating . ratingCount >= 3 && count ( director ) >= 6 ) [ 1 ] ;
1828	i 'm searching for the movie that has a rating of 2 and 1 .	@org.schema.Movie . Movie ( ) filter aggregateRating . ratingValue == 1 && aggregateRating . ratingValue == 2 ;
1829	find the movie that has the rating of 2 and 1 .	@org.schema.Movie . Movie ( ) filter aggregateRating . ratingValue == 1 && aggregateRating . ratingValue == 2 ;
1830	find movies with keywords QUOTED_STRING_0 and the lowest rating count .	sort ( aggregateRating . ratingCount asc of @org.schema.Movie . Movie ( ) filter keywords =~ QUOTED_STRING_0 ) [ 1 ] ;
1831	find movie with the keywords containing QUOTED_STRING_0 with the lowest rating count	sort ( aggregateRating . ratingCount asc of @org.schema.Movie . Movie ( ) filter keywords =~ QUOTED_STRING_0 ) [ 1 ] ;
1832	show me movies that are rated both 4 and 4 star	@org.schema.Movie . Movie ( ) filter aggregateRating . ratingValue == 4 && aggregateRating . ratingValue == 4 ;
1833	give me a list of movies that have both a 4 and 4 star rating	@org.schema.Movie . Movie ( ) filter aggregateRating . ratingValue == 4 && aggregateRating . ratingValue == 4 ;
1834	show me the movie with at least 6 directors and that have a bigger rating count than 3 with the greatest length	sort ( duration desc of @org.schema.Movie . Movie ( ) filter aggregateRating . ratingCount >= 3 && count ( director ) >= 6 ) [ 1 ] ;
1835	i 'm looking for a movie with minimum 6 directors and that have a greater than 3 rating and the largest length	sort ( duration desc of @org.schema.Movie . Movie ( ) filter aggregateRating . ratingCount >= 3 && count ( director ) >= 6 ) [ 1 ] ;
1836	find a movie rated 2 and 1	@org.schema.Movie . Movie ( ) filter aggregateRating . ratingValue == 1 && aggregateRating . ratingValue == 2 ;
1837	show me the movie that is rated 1 and 2	@org.schema.Movie . Movie ( ) filter aggregateRating . ratingValue == 1 && aggregateRating . ratingValue == 2 ;
1838	find movies having keywords of QUOTED_STRING_0 that has the least rating count	sort ( aggregateRating . ratingCount asc of @org.schema.Movie . Movie ( ) filter keywords =~ QUOTED_STRING_0 ) [ 1 ] ;
1839	find the movies with keywords QUOTED_STRING_0 with the smallest rating count	sort ( aggregateRating . ratingCount asc of @org.schema.Movie . Movie ( ) filter keywords =~ QUOTED_STRING_0 ) [ 1 ] ;
1840	make a list of movies with 4 star ratings or 4 ratings .	@org.schema.Movie . Movie ( ) filter aggregateRating . ratingValue == 4 && aggregateRating . ratingValue == 4 ;
1841	cite all 4 rated and 4 star rated movies .	@org.schema.Movie . Movie ( ) filter aggregateRating . ratingValue == 4 && aggregateRating . ratingValue == 4 ;
1842	what is the longest , 3 plus rated movie with 6 or more directors ?	sort ( duration desc of @org.schema.Movie . Movie ( ) filter aggregateRating . ratingCount >= 3 && count ( director ) >= 6 ) [ 1 ] ;
1843	name the movie with the greatest duration rated above 3 that was directed by no fewer than 6 directors .	sort ( duration desc of @org.schema.Movie . Movie ( ) filter aggregateRating . ratingCount >= 3 && count ( director ) >= 6 ) [ 1 ] ;
1844	find movies rated a 2 and rated a 1 .	@org.schema.Movie . Movie ( ) filter aggregateRating . ratingValue == 1 && aggregateRating . ratingValue == 2 ;
1845	i want 1 - and 2 - rated movies .	@org.schema.Movie . Movie ( ) filter aggregateRating . ratingValue == 1 && aggregateRating . ratingValue == 2 ;
1846	i 'm looking for the lowest rated movie with the keywords QUOTED_STRING_0 .	sort ( aggregateRating . ratingCount asc of @org.schema.Movie . Movie ( ) filter keywords =~ QUOTED_STRING_0 ) [ 1 ] ;
1847	find the movie associated with the keywords QUOTED_STRING_0 that has the smallest rating number .	sort ( aggregateRating . ratingCount asc of @org.schema.Movie . Movie ( ) filter keywords =~ QUOTED_STRING_0 ) [ 1 ] ;
1848	show me a movie that has exactly 12 reviews	@org.schema.Movie . Movie ( ) filter count ( review ) == 12 ;
1849	what movie has a review count of 12 ?	@org.schema.Movie . Movie ( ) filter count ( review ) == 12 ;
1850	give me the movie name that has the lowest number of ratings	sort ( aggregateRating . ratingCount asc of @org.schema.Movie . Movie ( ) ) [ 1 ] ;
1851	what is the movie called that has the fewest ratings ?	sort ( aggregateRating . ratingCount asc of @org.schema.Movie . Movie ( ) ) [ 1 ] ;
1852	show me all movies with less than 7 ratings	@org.schema.Movie . Movie ( ) filter aggregateRating . ratingCount <= 6 ;
1853	tell me what movies have 6 or fewer ratings	@org.schema.Movie . Movie ( ) filter aggregateRating . ratingCount <= 6 ;
1854	what is the name of the highest rated movie ?	sort ( aggregateRating . ratingValue desc of @org.schema.Movie . Movie ( ) ) [ 1 ] ;
1855	give me the title of the film with the highest overall rating	sort ( aggregateRating . ratingValue desc of @org.schema.Movie . Movie ( ) ) [ 1 ] ;
1856	show me a movie which has 12 reviews .	@org.schema.Movie . Movie ( ) filter count ( review ) == 12 ;
1857	locate a 12 review movie for me .	@org.schema.Movie . Movie ( ) filter count ( review ) == 12 ;
1858	let me know the name of the movie with the minimum rating count .	sort ( aggregateRating . ratingCount asc of @org.schema.Movie . Movie ( ) ) [ 1 ] ;
1859	find out for me the minimum rating count movie 's name .	sort ( aggregateRating . ratingCount asc of @org.schema.Movie . Movie ( ) ) [ 1 ] ;
1860	compile a list of films with 6 or less rating counts	@org.schema.Movie . Movie ( ) filter aggregateRating . ratingCount <= 6 ;
1861	make a list for me of movies that have 6 or less as their rating count .	@org.schema.Movie . Movie ( ) filter aggregateRating . ratingCount <= 6 ;
1862	what are the names of the highest rated movies ?	sort ( aggregateRating . ratingValue desc of @org.schema.Movie . Movie ( ) ) [ 1 ] ;
1863	i want to know the names of the highest rated movies .	sort ( aggregateRating . ratingValue desc of @org.schema.Movie . Movie ( ) ) [ 1 ] ;
1864	find a movie with 12 reviews	@org.schema.Movie . Movie ( ) filter count ( review ) == 12 ;
1865	show me a movie having 12 reviews	@org.schema.Movie . Movie ( ) filter count ( review ) == 12 ;
1866	tell me what movies are called that have the minimum rating count	sort ( aggregateRating . ratingCount asc of @org.schema.Movie . Movie ( ) ) [ 1 ] ;
1867	show me what movies are named that have the minimum rating count	sort ( aggregateRating . ratingCount asc of @org.schema.Movie . Movie ( ) ) [ 1 ] ;
1868	find a movie list that has 6 or less ratings	@org.schema.Movie . Movie ( ) filter aggregateRating . ratingCount <= 6 ;
1869	bring up a movie list that has 6 or under ratings	@org.schema.Movie . Movie ( ) filter aggregateRating . ratingCount <= 6 ;
1870	find the movie name with the greatest rating	sort ( aggregateRating . ratingValue desc of @org.schema.Movie . Movie ( ) ) [ 1 ] ;
1871	show me the movie name that has the biggest rating	sort ( aggregateRating . ratingValue desc of @org.schema.Movie . Movie ( ) ) [ 1 ] ;
1872	what is the length of the shortest movie	[ duration ] of sort ( duration asc of @org.schema.Movie . Movie ( ) ) [ 1 ] ;
1873	how long is the shortest movie	[ duration ] of sort ( duration asc of @org.schema.Movie . Movie ( ) ) [ 1 ] ;
1874	i want the movie that is longer than NUMBER_0 minutes and is nc 17 and has 2 or lower for the rating count	@org.schema.Movie . Movie ( ) filter aggregateRating . ratingCount <= 2 && contentRating == enum NC17 && duration >= NUMBER_0 min ;
1875	what movie lasting longer than NUMBER_0 hours is pg13 and has 2 or lower for the rating count	@org.schema.Movie . Movie ( ) filter aggregateRating . ratingCount <= 2 && contentRating == enum PG13 && duration >= 2 h ;
1876	what are QUOTED_STRING_0 movies with a rating count less than 5	@org.schema.Movie . Movie ( ) filter aggregateRating . ratingCount <= 5 && id =~ QUOTED_STRING_0 ;
1877	what QUOTED_STRING_0 movies have a rating count of less than 5	@org.schema.Movie . Movie ( ) filter aggregateRating . ratingCount <= 5 && id =~ QUOTED_STRING_0 ;
1878	i want movies that have 12 actresses at most and a rating of 2	@org.schema.Movie . Movie ( ) filter aggregateRating . ratingValue == 2 && count ( actor ) <= 12 ;
1879	what movies have at most 12 actresses and a rating of 2	@org.schema.Movie . Movie ( ) filter aggregateRating . ratingValue == 2 && count ( actor ) <= 12 ;
1880	tell me the duration of the movies with the least duration	[ duration ] of sort ( duration asc of @org.schema.Movie . Movie ( ) ) [ 1 ] ;
1881	find the run time of the movies with the shortest run time	[ duration ] of sort ( duration asc of @org.schema.Movie . Movie ( ) ) [ 1 ] ;
1882	find a movie with a rating count of 2 or less that rated r with a longer run time than NUMBER_0 minutes	@org.schema.Movie . Movie ( ) filter aggregateRating . ratingCount <= 2 && contentRating == enum R && duration >= NUMBER_0 min ;
1883	search for a movie that is rated pg with a duration longer than NUMBER_0 minutes and a rating count of 2 or lower .	@org.schema.Movie . Movie ( ) filter aggregateRating . ratingCount <= 2 && contentRating == enum PG && duration >= NUMBER_0 min ;
1884	find QUOTED_STRING_0 movie that has a rating count less than 5	@org.schema.Movie . Movie ( ) filter aggregateRating . ratingCount <= 5 && id =~ QUOTED_STRING_0 ;
1885	search for QUOTED_STRING_0 movie with a rating count smaller than 5	@org.schema.Movie . Movie ( ) filter aggregateRating . ratingCount <= 5 && id =~ QUOTED_STRING_0 ;
1886	find a movie with no more than 12 actress and a rating of 2	@org.schema.Movie . Movie ( ) filter aggregateRating . ratingValue == 2 && count ( actor ) <= 12 ;
1887	search for movies with a rating of 2 and no more than 12 actress	@org.schema.Movie . Movie ( ) filter aggregateRating . ratingValue == 2 && count ( actor ) <= 12 ;
1888	search for shortest duration movies .	[ duration ] of sort ( duration asc of @org.schema.Movie . Movie ( ) ) [ 1 ] ;
1889	i need movies with the shortest duration .	[ duration ] of sort ( duration asc of @org.schema.Movie . Movie ( ) ) [ 1 ] ;
1890	search for a movie longer than NUMBER_0 hours with a rating count of 2 or less and g	@org.schema.Movie . Movie ( ) filter aggregateRating . ratingCount <= 2 && contentRating == enum G && duration >= 2 h ;
1891	find me a movie longer than NUMBER_0 minutes that 's pg and have a 2 or lower rating count .	@org.schema.Movie . Movie ( ) filter aggregateRating . ratingCount <= 2 && contentRating == enum PG && duration >= NUMBER_0 min ;
1892	search for QUOTED_STRING_0 movies with a rating count less than 5 .	@org.schema.Movie . Movie ( ) filter aggregateRating . ratingCount <= 5 && id =~ QUOTED_STRING_0 ;
1893	i need QUOTED_STRING_0 movies with a less than 5 rating .	@org.schema.Movie . Movie ( ) filter aggregateRating . ratingCount <= 5 && id =~ QUOTED_STRING_0 ;
1894	search for any movies with at least 12 actresses and a rating of 2 .	@org.schema.Movie . Movie ( ) filter aggregateRating . ratingValue == 2 && count ( actor ) <= 12 ;
1895	i am looking for movies with 12 actresses and a rating of 2 .	@org.schema.Movie . Movie ( ) filter aggregateRating . ratingValue == 2 && count ( actor ) <= 12 ;
1896	what movie with a pg 13 rating has the fewest ratings	sort ( aggregateRating . ratingCount asc of @org.schema.Movie . Movie ( ) filter contentRating == enum PG13 ) [ 1 ] ;
1897	show me the movie with the smallest rating count that has is pg rated	sort ( aggregateRating . ratingCount asc of @org.schema.Movie . Movie ( ) filter contentRating == enum PG ) [ 1 ] ;
1898	what movies have 11 or less ratings and a rating matching 3 and 5	@org.schema.Movie . Movie ( ) filter aggregateRating . ratingCount <= 12 && aggregateRating . ratingValue == 3 && aggregateRating . ratingValue == 5 ;
1899	tell me what films are rated exactly 3 and 5 stars with a rating count below 12	@org.schema.Movie . Movie ( ) filter aggregateRating . ratingCount <= 12 && aggregateRating . ratingValue == 3 && aggregateRating . ratingValue == 5 ;
1900	show the movie with the worst rating that has 10 actresses and more than 8 ratings	sort ( aggregateRating . ratingValue asc of @org.schema.Movie . Movie ( ) filter aggregateRating . ratingCount >= 8 && count ( actor ) == 10 ) [ 1 ] ;
1901	tell me what movie with at least 9 ratings and and 10 actresses has the lowest overall rating	sort ( aggregateRating . ratingValue asc of @org.schema.Movie . Movie ( ) filter aggregateRating . ratingCount >= 8 && count ( actor ) == 10 ) [ 1 ] ;
1902	i want to find any film that has 2 directors	@org.schema.Movie . Movie ( ) filter count ( director ) == 2 ;
1903	show all movies directed by 2 people	@org.schema.Movie . Movie ( ) filter count ( director ) == 2 ;
1904	get the pg 13 rated movie with the lowest rating count	sort ( aggregateRating . ratingCount asc of @org.schema.Movie . Movie ( ) filter contentRating == enum PG13 ) [ 1 ] ;
1905	i want the pg 13 rated movie with the lowest rating count	sort ( aggregateRating . ratingCount asc of @org.schema.Movie . Movie ( ) filter contentRating == enum PG13 ) [ 1 ] ;
1906	what movie is rated both 5 and 3 star and has less than 12 ratings	@org.schema.Movie . Movie ( ) filter aggregateRating . ratingCount <= 12 && aggregateRating . ratingValue == 3 && aggregateRating . ratingValue == 5 ;
1907	what is the movie with less than 12 ratings that is rated both 5 and 3 stars	@org.schema.Movie . Movie ( ) filter aggregateRating . ratingCount <= 12 && aggregateRating . ratingValue == 3 && aggregateRating . ratingValue == 5 ;
1908	i want the movie with the lowest rating out of the movies with 10 actresses and a rating count higher than 8	sort ( aggregateRating . ratingValue asc of @org.schema.Movie . Movie ( ) filter aggregateRating . ratingCount >= 8 && count ( actor ) == 10 ) [ 1 ] ;
1909	what is the movie with the lowest rating of the movies with 10 actresses and a rating count over 8	sort ( aggregateRating . ratingValue asc of @org.schema.Movie . Movie ( ) filter aggregateRating . ratingCount >= 8 && count ( actor ) == 10 ) [ 1 ] ;
1910	i want any movie that has 2 directors	@org.schema.Movie . Movie ( ) filter count ( director ) == 2 ;
1911	what movies have 2 directors	@org.schema.Movie . Movie ( ) filter count ( director ) == 2 ;
1912	which nc17 rated movie has the least rating count ?	sort ( aggregateRating . ratingCount asc of @org.schema.Movie . Movie ( ) filter contentRating == enum NC17 ) [ 1 ] ;
1913	of movies rated nc17 which one has the lowest rating count ?	sort ( aggregateRating . ratingCount asc of @org.schema.Movie . Movie ( ) filter contentRating == enum NC17 ) [ 1 ] ;
1914	which movie was less than 12 ratings is rated both 5 and 3 stars ?	@org.schema.Movie . Movie ( ) filter aggregateRating . ratingCount <= 12 && aggregateRating . ratingValue == 3 && aggregateRating . ratingValue == 5 ;
1915	find me the 5 and 3 star film with less than 12 ratings .	@org.schema.Movie . Movie ( ) filter aggregateRating . ratingCount <= 12 && aggregateRating . ratingValue == 3 && aggregateRating . ratingValue == 5 ;
1916	of movies with more than 10 actresses and large rating count over 8 which has the lowest rating ?	sort ( aggregateRating . ratingValue asc of @org.schema.Movie . Movie ( ) filter aggregateRating . ratingCount >= 8 && count ( actor ) == 10 ) [ 1 ] ;
1917	what movie with a higher than 8 rating count and more than 10 actresses has the lowest rating ?	sort ( aggregateRating . ratingValue asc of @org.schema.Movie . Movie ( ) filter aggregateRating . ratingCount >= 8 && count ( actor ) == 10 ) [ 1 ] ;
1918	find me any film that has 2 directors .	@org.schema.Movie . Movie ( ) filter count ( director ) == 2 ;
1919	fetch movies that have 2 directors .	@org.schema.Movie . Movie ( ) filter count ( director ) == 2 ;
1920	fidn the movei genre that was published before DATE_0 .	[ genre ] of @org.schema.Movie . Movie ( ) filter datePublished <= DATE_0 ;
1921	i 'm looking for movie genres that were published prior to DATE_0	[ genre ] of @org.schema.Movie . Movie ( ) filter datePublished <= DATE_0 ;
1924	tell me the genre that the great movie has	[ genre ] of @org.schema.Movie . Movie ( ) filter aggregateRating . ratingValue >= 4 ;
1925	i 'm looking for the genre that the great movie has	[ genre ] of @org.schema.Movie . Movie ( ) filter aggregateRating . ratingValue >= 4 ;
1926	find all movies that has creator containing either tyrone power or george lucas	@org.schema.Movie . Movie ( ) filter contains ( creator , null ^^org.schema.Movie:Person ( " george lucas " ) ) || contains ( creator , null ^^org.schema.Movie:Person ( " tyrone power " ) ) ;
1927	show me all movies that were made by either george lucas or tyrone power .	@org.schema.Movie . Movie ( ) filter contains ( creator , null ^^org.schema.Movie:Person ( " george lucas " ) ) || contains ( creator , null ^^org.schema.Movie:Person ( " tyrone power " ) ) ;
1928	identify the genre for the movie released prior to DATE_0 .	[ genre ] of @org.schema.Movie . Movie ( ) filter datePublished <= DATE_0 ;
1929	for movies with a publication date preceding DATE_0 , tell me the genre .	[ genre ] of @org.schema.Movie . Movie ( ) filter datePublished <= DATE_0 ;
1932	identify the genre of a really good movie .	[ genre ] of @org.schema.Movie . Movie ( ) filter aggregateRating . ratingValue >= 4 ;
1933	tell me the genre of a movie considered great .	[ genre ] of @org.schema.Movie . Movie ( ) filter aggregateRating . ratingValue >= 4 ;
1934	find every movie made by tyrone power or george lucas .	@org.schema.Movie . Movie ( ) filter contains ( creator , null ^^org.schema.Movie:Person ( " george lucas " ) ) || contains ( creator , null ^^org.schema.Movie:Person ( " tyrone power " ) ) ;
